{
  "schemaVersion": 2,
  "candidateCommit": "0000000000000000000000000000000000000000",
  "environment": "openopc-public-beta-staging",
  "releaseProfileId": "openopc-restricted-public-beta-v1",
  "releaseProfileDigest": "sha256:e548465c35cb5041b38092b2937164f2abecfb6781ab0e545532ce95f387956c",
  "schemaDigest": "sha256:0000000000000000000000000000000000000000000000000000000000000000",
  "artifactSetDigest": "sha256:0000000000000000000000000000000000000000000000000000000000000000",
  "records": []
}
